{
  "$schema": "https://json-schema.org/draft/2020-12/schema",
  "$id": "https://example.org/pediatric-anemia/schemas/patient-input.schema.json",
  "title": "Pediatric Anemia CDSS Patient Input",
  "type": "object",
  "additionalProperties": false,
  "properties": {
    "patient": {
      "type": "object",
      "additionalProperties": false,
      "properties": {
        "ageMonths": { "type": ["number", "null"], "minimum": 0, "maximum": 300 },
        "sexAtBirth": { "type": ["string", "null"], "enum": ["female", "male", "unspecified", null] },
        "menstruating": { "$ref": "#/$defs/triBoolean" },
        "recentTransfusion": { "$ref": "#/$defs/triBoolean" },
        "highAltitude": { "$ref": "#/$defs/triBoolean" }
      }
    },
    "cbc": {
      "type": "object",
      "additionalProperties": false,
      "properties": {
        "hemoglobin": { "type": ["number", "null"], "minimum": 0, "maximum": 30, "description": "g/dL" },
        "hemoglobinUnit": { "type": "string" },
        "mcv": { "type": ["number", "null"], "minimum": 20, "maximum": 160, "description": "fL" },
        "mcvUnit": { "type": "string" },
        "rdw": { "type": ["number", "null"], "minimum": 5, "maximum": 40, "description": "%" },
        "rdwUnit": { "type": "string" },
        "rbc": { "type": ["number", "null"], "minimum": 0, "maximum": 12, "description": "10^12/L" },
        "rbcUnit": { "type": "string" },
        "wbc": { "type": ["number", "null"], "minimum": 0, "maximum": 100, "description": "10^9/L" },
        "wbcUnit": { "type": "string" },
        "anc": { "type": ["number", "null"], "minimum": 0, "maximum": 50, "description": "10^9/L" },
        "ancUnit": { "type": "string" },
        "platelets": { "type": ["number", "null"], "minimum": 0, "maximum": 2000, "description": "10^9/L" },
        "plateletsUnit": { "type": "string" },
        "rbcInterpretation": { "type": "string", "enum": ["unknown", "high-for-age", "normal", "low"] },
        "localRanges": {
          "type": "object",
          "additionalProperties": false,
          "properties": {
            "hbLower": { "type": ["number", "null"] },
            "hbLowerUnit": { "type": "string" },
            "mcvLower": { "type": ["number", "null"] },
            "mcvLowerUnit": { "type": "string" },
            "mcvUpper": { "type": ["number", "null"] },
            "mcvUpperUnit": { "type": "string" },
            "rdwUpper": { "type": ["number", "null"] },
            "rdwUpperUnit": { "type": "string" },
            "wbcLower": { "type": ["number", "null"] },
            "wbcLowerUnit": { "type": "string" },
            "ancLower": { "type": ["number", "null"] },
            "ancLowerUnit": { "type": "string" },
            "plateletsLower": { "type": ["number", "null"] },
            "plateletsLowerUnit": { "type": "string" }
          }
        },
        "localFlags": {
          "type": "object",
          "additionalProperties": false,
          "properties": {
            "leukopenia": { "$ref": "#/$defs/triBoolean" },
            "neutropenia": { "$ref": "#/$defs/triBoolean" },
            "thrombocytopenia": { "$ref": "#/$defs/triBoolean" },
            "thrombocytosis": { "$ref": "#/$defs/triBoolean" }
          }
        }
      }
    },
    "reticulocytes": {
      "type": "object",
      "additionalProperties": false,
      "properties": {
        "response": { "type": "string", "enum": ["unknown", "low", "inappropriately-normal", "appropriate", "high"] },
        "absolute": { "type": ["number", "null"], "minimum": 0 }
      }
    },
    "symptoms": { "$ref": "#/$defs/booleanMap" },
    "history": { "$ref": "#/$defs/booleanMap" },
    "exam": { "$ref": "#/$defs/booleanMap" },
    "labs": {
      "type": "object",
      "additionalProperties": false,
      "properties": {
        "ferritin": { "type": ["number", "null"], "minimum": 0, "description": "ng/mL" },
        "ferritinUnit": { "type": "string" },
        "ferritinStatus": { "$ref": "#/$defs/genericStatus" },
        "crpStatus": { "type": "string", "enum": ["unknown", "normal", "elevated"] },
        "tsatStatus": { "$ref": "#/$defs/lowNormalHigh" },
        "tibcStatus": { "$ref": "#/$defs/lowNormalHigh" },
        "ironStatus": { "$ref": "#/$defs/lowNormalHigh" },
        "stfrFerritinIndex": { "type": ["number", "null"], "minimum": 0 },
        "stfrFerritinIndexUnit": { "type": "string" },
        "indirectBilirubinStatus": { "type": "string", "enum": ["unknown", "normal", "high"] },
        "ldhStatus": { "type": "string", "enum": ["unknown", "normal", "high"] },
        "haptoglobinStatus": { "type": "string", "enum": ["unknown", "normal", "low"] },
        "datStatus": { "type": "string", "enum": ["unknown", "negative", "positive"] },
        "bloodLeadLevel": { "type": ["number", "null"], "minimum": 0, "description": "µg/dL" },
        "bloodLeadLevelUnit": { "type": "string" },
        "leadSpecimen": { "type": "string", "enum": ["unknown", "capillary", "venous"] },
        "hbA2Status": { "type": "string", "enum": ["unknown", "normal", "elevated"] },
        "hbBartNewbornScreen": { "$ref": "#/$defs/triBoolean" },
        "alphaGlobinTestingPositive": { "$ref": "#/$defs/triBoolean" },
        "betaGlobinTestingPositive": { "$ref": "#/$defs/triBoolean" },
        "sicklingHemoglobinDetected": { "$ref": "#/$defs/triBoolean" },
        "g6pdStatus": { "type": "string", "enum": ["unknown", "normal", "deficient"] },
        "g6pdTestDuringAcuteHemolysis": { "$ref": "#/$defs/triBoolean" },
        "g6pdTestSoonAfterTransfusion": { "$ref": "#/$defs/triBoolean" },
        "b12Status": { "$ref": "#/$defs/lowNormalUnknown" },
        "folateStatus": { "$ref": "#/$defs/lowNormalUnknown" },
        "copperStatus": { "$ref": "#/$defs/lowNormalUnknown" },
        "creatinineStatus": { "type": "string", "enum": ["unknown", "normal", "high"] },
        "tshStatus": { "type": "string", "enum": ["unknown", "normal", "high"] },
        "liverTestsStatus": { "type": "string", "enum": ["unknown", "normal", "abnormal"] }
      }
    },
    "smear": {
      "type": "array",
      "uniqueItems": true,
      "items": {
        "type": "string",
        "enum": [
          "target-cells", "spherocytes", "schistocytes", "bite-or-blister-cells",
          "sickle-cells", "basophilic-stippling", "hypersegmented-neutrophils",
          "blasts", "teardrops", "nucleated-rbc", "elliptocytes"
        ]
      }
    }
  },
  "$defs": {
    "triBoolean": {
      "description": "A boolean clinical fact may be sent as a bare JSON boolean or as the existing true, false, or unknown tri-state wire string. Omission remains the not-assessed capture state and is not a fourth engine literal.",
      "anyOf": [
        { "type": "boolean" },
        { "type": "string", "enum": ["true", "false", "unknown"] }
      ]
    },
    "booleanMap": {
      "type": "object",
      "description": "Wire-compatible boolean fact map: callers may continue sending bare JSON booleans or send the SPIKE-003 tri-state strings true, false, or unknown. Field names remain open here; scripts/validate-kb.mjs validates rule-referenced history.*, symptoms.*, and exam.* paths against the maintained allow-list.",
      "additionalProperties": { "$ref": "#/$defs/triBoolean" }
    },
    "genericStatus": { "type": "string", "enum": ["unknown", "normal", "high"] },
    "lowNormalHigh": { "type": "string", "enum": ["unknown", "low", "normal", "high"] },
    "lowNormalUnknown": { "type": "string", "enum": ["unknown", "low", "normal"] }
  }
}
