{
  "patient": { "ageMonths": 84, "sexAtBirth": "female", "menstruating": false, "recentTransfusion": false, "highAltitude": false },
  "cbc": {
    "hemoglobin": 6.5, "mcv": 82, "rdw": 13.5, "rbc": 2.4, "wbc": 9.0, "platelets": 310,
    "rbcInterpretation": "low", "localRanges": {}, "localFlags": {}
  },
  "reticulocytes": { "response": "inappropriately-normal" },
  "symptoms": { "activeMajorBleeding": true, "hemodynamicInstability": true, "pallor": true, "fatigue": true },
  "history": { "giBloodLoss": true },
  "exam": {},
  "labs": {},
  "smear": []
}
