{
  "patient": { "ageMonths": 100, "menstruating": false, "recentTransfusion": false, "highAltitude": false },
  "cbc": {
    "hemoglobin": 10.8, "mcv": 74, "rdw": 15, "rbc": 4.4, "wbc": 7.1, "platelets": 350,
    "rbcInterpretation": "normal", "localRanges": {}, "localFlags": {}
  },
  "reticulocytes": { "response": "unknown" },
  "symptoms": {},
  "history": {},
  "exam": {},
  "labs": { "ferritin": 25, "ferritinStatus": "normal" },
  "smear": []
}
