{
  "patient": { "ageMonths": 48, "sexAtBirth": "male", "menstruating": false, "recentTransfusion": false, "highAltitude": false },
  "cbc": {
    "hemoglobin": 10.5, "mcv": 70, "rdw": 15.5, "rbc": 4.6, "wbc": 8.2, "platelets": 400,
    "rbcInterpretation": "normal", "localRanges": {}, "localFlags": {}
  },
  "reticulocytes": { "response": "inappropriately-normal" },
  "symptoms": { "fatigue": true },
  "history": { "lowIronDiet": true },
  "exam": {},
  "labs": { "ferritin": 9, "ferritinStatus": "normal", "crpStatus": "normal" },
  "smear": []
}
