{
  "patient": { "ageMonths": 3, "sexAtBirth": "male", "menstruating": false, "recentTransfusion": false, "highAltitude": false },
  "cbc": { "localRanges": { "hbLower": 9, "mcvLower": 70, "mcvUpper": 85 } },
  "reticulocytes": {},
  "symptoms": {},
  "history": {},
  "exam": {},
  "labs": {},
  "smear": []
}
